标题,时间,来源,正文,作者,评论数
山东：稳妥有序推进美丽宜居乡村建设,2020-06-27,环球网,原标题：山东：稳妥有序推进美丽宜居乡村建设 我省召开美丽宜居乡村建设视频会议 稳妥有序推进美丽宜居乡村建设 更加深入扎实打造乡村振兴齐鲁样板 6月27日上午，我省召开美丽宜居乡村建设视频会议，深入学习贯彻习近平总书记关于实施乡村振兴战略的重要论述，分析我省统筹推进村庄规划、优化村庄布局、建设美丽宜居乡村工作情况，安排部署下一步工作，更加深入扎实地打造乡村振兴齐鲁样板。 省委书记刘家义出席会议并讲话，省委副书记、代省长李干杰主持，省委副书记杨东奇出席。 刘家义在讲话中指出，习近平总书记对“三农”工作高度重视，多次发表重要讲话、作出重要指示，深刻阐明了实施乡村振兴战略一系列重大理论和实践问题，为做好新时代“三农”工作提供了根本遵循。总书记要求山东发挥农业大省优势，扛起农业大省责任，打造乡村振兴的齐鲁样板，这是对我们的巨大信任和鼓舞，也是交给我们的一项重大政治任务。我们必须学深悟透习近平总书记重要指示要求，深刻领会贯穿其中的科学立场观点方法，结合实际抓好贯彻落实，以实际行动增强“四个意识”、坚定“四个自信”、坚决做到“两个维护”。 刘家义指出，近年来，我省各级认真贯彻落实党中央、国务院的部署要求，聚焦聚力推进乡村产业振兴、人才振兴、文化振兴、生态振兴、组织振兴，充分尊重和顺应群众意愿，坚持因地制宜、分类施策、统筹谋划、精准发力，稳步推进美丽宜居乡村建设，探索出各具特色的发展路子。总体上看，我省建设美丽宜居乡村工作，是一个循序渐进的过程，适应了农村生产关系、生产经营方式的调整变化，符合乡村建设规律要求，方向是正确的，政策是妥当的，推进是有成效的，促进了农村生产力发展，改善了农民生活条件，提高了农民生活质量，绝大多数群众是满意的。但也要清醒地看到，我们的工作还有很多差距，个别地方思想认识有偏差，工作统筹衔接不够，征求群众意愿不充分，侵害群众利益问题仍然存在，有的地方工作推进存在冒进倾向，做群众工作不深不细、工作简单化。对这些问题，我们要实事求是对待，认真查摆分析，逐一整改提升，切实把这项工作更加稳妥有序、深入扎实推进下去，努力使我省农业强起来、农村美起来、农民富起来。 刘家义强调，美丽宜居乡村建设事关群众切身利益、事关农村社会治理、事关全面建成小康社会，必须在现有基础上，全面检视，坚持因地制宜、改革创新、统筹谋划、综合施策、精准发展，稳妥有序推进各项工作。一要更加注重维护群众利益。始终把人民群众的利益放在首位，决不能因为搞美丽宜居乡村建设增加农民负担，损害农民利益。二要更加注重顺应群众意愿。充分听取农民意见，决不能逼迫农民同意，真正把群众说了算落到实处。三要更加注重顺应发展规律，不能超越现有经济基础和发展阶段强行推进。四要更加注重尊重群众首创精神。对各地创造的好做法，要深入总结提升，加大推广力度，相互学习借鉴。五要更加注重因地制宜、精准施策。科学把握各地差异特点，宜农则农，宜工则工，宜商则商，宜文则文，宜旅游则旅游，宜生态则生态，立足实际有序推进。六要更加注重规划引领。在建项目要严格按规划进行，没有规划的决不能乱上。今年要在分类基础上，基本完成村庄优化布局规划工作，有条件、有需求的村庄实现规划应编尽编。七要更加注重统筹协调。把乡村振兴与美丽宜居乡村建设、农村人居环境整治、农村“七改”、脱贫攻坚、基层党建等工作统筹起来，把资金、资源、公共基础设施整合起来，精准施策、一体推进，全面改善农村生产生活环境，让老百姓、让子孙后代、让所有在外的山东人留下念想、记住乡愁，让群众有看得见、摸得着的获得感幸福感安全感。八要更加注重政府引导、市场主导。把充分发挥市场决定作用和更好发挥政府作用结合起来，政府要在规划引导、政策支持、市场监管、法律保障等方面做好工作。 刘家义指出，当前，要在全省范围对优化村庄布局、建设美丽宜居乡村工作开展“回头看”。各市、县要迅速行动起来，对本辖区美丽宜居乡村建设情况进行一次全面摸底，对存在的问题即知即改、边查边改，确保按期整改到位。要坚持统筹把握、分类处置，对已经拆迁尚未搬入新居的，要在确保工程质量的前提下，加快建设进度，让群众早日入住。对临时居住安置不到位的，要一户一策、明确时限予以解决，确保群众生命财产安全。对正在实施的，要深入听取群众意见，把政策讲清楚，取得一致共识。对正在实施但群众意见较大的、正在研究准备实施的、以及已经研究尚未实施的，先一律暂停，进行重新甄别。通过甄别，使乡村建设规划成为一个尊重群众意愿，符合发展规律，高起点、高水平的规划。要进一步完善村庄分类，对因人口流失严重、村庄规模小、公共基础设施差、产业发展潜力弱等原因需要搬迁的，必须进行重新甄别审核、审批、备案，进行系统研究，稳妥有序推进。要针对当前存在的问题，抓紧研究制定推动美丽宜居乡村建设的规范意见，为各级开展工作提供遵循。要积极主动做好舆情引导，努力营造良好舆论氛围。 刘家义强调，优化村庄布局、建设美丽宜居乡村是一项民心工程，要压实美丽宜居乡村建设责任，牢记初心使命，把好事办好，决不能把民心工程搞成“民怨工程”。各级党委、政府主要负责同志要负总责、亲自抓，各有关部门主要负责同志要认真履职尽责，坚持问题导向，及时回应群众诉求。要加强督导检查，对美丽宜居乡村建设中存在的问题及时纠偏，深入了解群众诉求，及时调整工作思路和方法。对不作为、慢作为、乱作为的，强行拆迁、损害群众利益的，要依法依规严肃查处。要切实改进作风。从省委常委会做起，全省各级普遍开展一次作风突出问题整顿，着力解决作风简单粗暴问题，着力解决宗旨意识不牢、群众路线不深入问题，着力解决急躁冒进、急功近利问题，着力解决形式主义、官僚主义问题，真正让广大群众理解支持我们的工作。通过大家的共同努力，切实把这项工作做好，向习近平总书记、向党中央、向全省人民交上一份合格答卷。 李干杰在主持时指出，要切实增强抓好美丽宜居乡村建设工作的责任感、使命感，把准把牢正确方向，以对人民高度负责的精神做好这项工作，真正把好事办成、办好。要突出工作重点，抓紧抓实抓细关键环节。各级各有关方面要迅速行动，全面开展“回头看”，彻底摸清底数，全面整改问题，完善工作规范，把工作做扎实、做细致、做到位。要突出效果导向，以效果倒逼工作落实、措施落地。注重采取务实管用的策略方法，压实工作责任、完善工作机制、把握工作节奏、严明工作纪律、做好宣传引导，以良好工作效果和扎实行动，奋力打造乡村振兴的齐鲁样板。 省和济南市、青岛市领导陈辐宽、王可、王书坚、孙立成、王清宪、刘强、于国安、孙述涛、孟凡利参加会议。 作者：张国栋 李子路 房贤刚 来源：大众报业·山东政事,祝加贝 ,367
北京通州万达广场完成全员核酸检测，均为阴性,2020-06-27,新京报,原标题：北京通州万达广场完成全员核酸检测，均为阴性 新京报讯（记者 王琳）6月27日，据新京报记者了解，北京通州万达广场已完成全员核酸检测，结果均为阴性。同时，广场内每天实行不低于五次的全面消杀，直梯、卫生间、门把手等使用频率较高的区域，会增加消杀频次。 “我们建立了工作人员健康监测制度，员工每天上班都需要测温监控，一旦发现异常，可以及时阻断疫情的传播。”通州万达广场副总经理王永平介绍，目前广场内所有人员、车辆出入口都有专人测温、检查，进入商场必须出示北京健康宝，无异常才可进入。 据介绍，部分正在装修施工的店铺，施工人员也必须出示核酸检测证明，确认无误才能进入。此外，万达广场还加大对餐饮企业的监管力度，要求各餐饮商家，食材全部采取直购方式，并对店内食材做到溯源。同时，严格做好店内环境消杀。 新京报记者 王琳,祝加贝 ,0
安徽发布山洪灾害气象预警 六安多地为红色预警,2020-06-27,央视,原标题：安徽发布山洪灾害气象预警 六安多地为红色预警 安徽省水利厅和安徽省气象局2020年6月27日18时联合发布山洪灾害气象预警：预计，2020年6月27日20时至6月28日20时，安庆市宜秀区、桐城市、怀宁县、宿松县、望江县可能发生山洪灾害（蓝色预警）；安庆市岳西县、潜山市、太湖县发生山洪灾害可能性大（橙色预警）；六安市金安区、裕安区、霍山县、金寨县、舒城县发生山洪灾害可能性很大（红色预警）。其他地区也可能因局地短历时强降水引发山洪灾害。请各地密切关注降雨情况，强化山洪灾害监测，及时发布预警信息，提前组织群众转移避险，确保人民群众生命安全。 此前安徽省气象局和安徽省自然资源厅联合发布地质灾害橙色预警。 橙色预警范围：六安市辖区及金寨县、霍山县、舒城县，安庆市的岳西县请加强防范，同时做好灾害隐患点上人员转移准备工作； 黄色预警范围：滁州市全境，合肥市全境，马鞍山市全境，六安市的霍邱县，安庆市的潜山市、桐城市，淮南市辖区及寿县，芜湖市辖区及无为市请注意防范，并加强隐患巡查和排查。（总台央视记者 张腾飞）,祝加贝 ,11
一图汇总！北京16天新增297名确诊病例情况,2020-06-27,北京日报客户端,原标题：一图汇总 | 北京16天新增297名确诊病例情况,祝加贝 ,354
四川发布甘孜州等7县市地灾黄色预警,2020-06-27,央视,原标题：四川发布甘孜州等7县市地灾黄色预警 6月27日，结合四川省气象台天气预报情况，四川省地质灾害指挥部办公室发布全省地灾气象风险预警，6月27日20时—6月28日20时，甘孜州康定市、丹巴县，阿坝州汶川县、小金县，凉山州喜德县、冕宁县、越西县地灾3级黄色预警。 四川省地质灾害指挥部办公室要求，发布地灾黄色预警，要密切关注降雨预报及降雨实况；检查防灾责任体系落实情况；加密房前屋后斜坡、靠山靠崖、沟口等危险地段巡查；做好监测预警和预警信息发布；发现险情迹象，果断采取主动预防避让，确保群众生命安全；做好突发地质灾害应急处置准备工作。（总台央视记者 张力）,祝加贝 ,0
多国疫情突然反弹，北京下一步怎么办？,2020-06-27,新浪新闻综合,原标题：多国疫情突然反弹，北京下一步怎么办？ 来源：国是直通车 绝不掉以轻心 最近，欧美、日本等不少国家疫情都突然反弹。面对新冠肺炎病毒这个狡猾的敌人，北京下一步将如何做好疫情防控？ 27日下午举行的北京市新型冠状病毒肺炎疫情防控工作新闻发布会上，官方对此作出回应。 封闭策略、隔离措施要继续严格执行 北京市政府新闻发言人徐和建称，从新发地批发市场发生聚集性疫情以来的病例分析、流调结果、传播轨迹来看，此次疫情涉及的行业、场景、人员、途径、症状等复杂多样，容不得我们丝毫掉以轻心、麻痹大意。 “任何一个人的掉以轻心、麻痹大意都可能引发新的问题，任何一个病毒污染的环境、病毒污染的物品都可能带来新的传播。”徐和建说，必须坚决果断地切断一切可能的病毒传播途径。实践证明，行之有效的封闭策略、隔离措施、救治办法、防疫要求等都要继续严格执行。 他表示，对新冠肺炎疫情，还有许多未知因素需要不断探索，需要随时根据新情况、新问题，实事求是、科学合理地调整和完善首都疫情防控的策略，需要树立不进则退、非进不可的信念，团结努力，共同保持疫情防控的向好态势。 将加强核酸检测价格管理 徐和建称，今后要坚持预防为主，将加快提升核酸检测能力、尽力扩大核酸检测范围作为落实“四早”要求的重点举措。做好对重点人群、重点行业的“应检尽检”工作，全力排查风险隐患。 针对费用问题，他表示，要加强核酸检测的价格管理和引导，支持实现“应检尽检”、“愿检尽检”，畅通试剂采购的渠道，完善检测项目价格政策，做好医保支付工作。 徐和建称，北京市美发店、美容店等服务行业要开展经营场所消杀作业和全员核酸检测，严格按照相关要求，坚持进店测温、查健康码等管理措施，科学佩戴口罩，保持安全距离，做好场所、工具“一客一换”“一客一消毒”，确保防疫安全。 如有感冒症状不要自行服药 从这几天北京通报的病例情况看，有些确诊患者自行服药后，发烧、嗓子痛等症状有所缓解，以为自己只是得了普通感冒，一查却发现是新冠肺炎。 对此，北京市疾控中心副主任庞星火提醒说，市民如果有发热、咽痛、干咳等症状，要及时到就近发热门诊就诊，不要到不具备条件的地方就诊治疗，不要自行服药，以免耽误病情。 拿快递、被蚊子咬会不会感染？ 中国疾病预防控制中心研究员王丽萍说，通过短时间接触快递被感染的几率很低。如果在家收快递，与快递员接触前要戴好口罩，处理好外包装，用流动清水和肥皂洗手。如果在小区门口收快递，出门戴好口罩，避免人员聚集，妥善处理快递外包装，及时洗手；如果有专门的投递箱，请快递员将物品放在投递箱，拿的时候戴好口罩，拿到后处理外包装，及时洗手。 针对夏季蚊蝇增多会不会加剧疫情传播，王丽萍说，蚊蝇“不具备传播新冠病毒的生物学基础”。,刘德宾 SN222,116
北京：西城启动隔离期满居民及同住人员二次核酸检测,2020-06-27,新浪新闻综合,原标题：北京：西城启动隔离期满居民及同住人员二次核酸检测 来源：北京青年报 北京青年报记者27日从北京西城区了解到，当日7时起，位于红莲北里的检测点开始对去过新发地、玉泉东市场等高危地区，且14天隔离期满的居民及同住人员，进行第二次的核酸检测。 北青报记者在现场看到，在工作人员的引导下，居民正有序地进行身份核实、登记和检测等。据介绍，除了这个检测点外，西城另有其他5个点位也在同时开展二次检测工作。 西城区区委书记卢映川在现场询问了街道目前需要二次检测的人员数量，以及这几天来常住居民的检测情况。卢映川强调，疫情形势依然严峻复杂，要始终跑在疫情的前头，利用好核酸检测这一手段，做到应检尽检，同时加强居家隔离观察人员的监测和生活服务保障，把工作做实、做细。 文/北京青年报记者 解丽,祝加贝 ,9
27日北京疫情风险等级无变化 高风险地区还是5个,2020-06-27,北京日报客户端,原标题：今日北京疫情风险等级无变化 高风险地区还是5个 记者从国务院客户端小程序“疫情风险等级查询”上了解到，截至6月27日15时，北京无新疫情风险等级变化。 目前北京市共有5个高风险地区— —丰台区花乡（地区）乡、新村街道，大兴区西红门（地区）镇、黄村（地区）镇，海淀区永定路街道；39个中风险地区，涉及丰台、大兴、海淀、西城、房山、东城、石景山、朝阳、门头沟、通州、昌平11个区。 按照规定，北京应急响应级别由三级调整至二级后，中高风险街乡、新发地市场相关人员禁止离京，其他人员坚持非必要不出京。确需离京的，要持7日内核酸检测阴性证明。,祝加贝 ,9
端午假期 这位政法委书记去了边境,2020-06-27,新浪新闻综合,原标题：端午假期，这位政法委书记去了边境 来源：北京青年报 这几天，林少春在边境调研。 据《内蒙古日报》消息，6月23日至26日，内蒙古自治区党委副书记、政法委书记林少春去了新巴尔虎左旗、新巴尔虎右旗和额尔古纳市，调研稳边固边、兴边富民、口岸发展和生态保护等工作，看望慰问护边牧民、部队官兵和基层干警。 一个月之内两赴边境一线 政知君注意到，本月以来，林少春至少两次前往边境调研。 6月7日至8日，林少春曾到锡林郭勒盟边境一线调研兴边富民、稳边固边和口岸发展等工作。 当时，他看望慰问边防部队官兵、边境派出所民警和居边护边群众，还为界碑“描红”。 在那次调研时，林少春提到，要进一步扩大对外开放，发挥中蒙双方在开放合作上的政策优势，找准定位，选准产业，把二连浩特中蒙经济合作区建成双边友好合作的典范。 他说，要继承和发扬戍边部队的优良传统，推动强军目标在连队、在边防落地生根，为祖国北疆安全稳定屏障再立新功。 而这次调研，他用时4天。 据当地媒体披露，林少春一行“沿边防巡逻路驱车千余公里到边境苏木，实地调研牧民生产生活、产业发展和巡边护边工作”。 他强调，要提升边境地区产业发展、对外开放和生态保护水平，巩固稳边固边、兴边富民的良好局面。 还有一个细节值得关注。 林少春还去了边防某部连队和诺门罕布日德、阿日哈沙特边境派出所。他希望大家，“为筑牢祖国北疆安全稳定屏障再立新功”。 “具有重要战略地位” 内蒙古方面对边防工作十分重视。 “内蒙古在国家边海防全局中具有重要战略地位，做好我区边防工作，筑牢祖国北疆安全稳定屏障，是我们必须扛起的重大政治责任。” 今年3月5日，内蒙古自治区边防委员会第一次会议召开。根据会议，内蒙古边防委员会的架构为： 主任：自治区党委书记石泰峰 第一副主任：自治区党委副书记、自治区主席布小林 副主任有： 党委副书记、政法委书记林少春 党委常委、自治区副主席马学军 内蒙古军区司令员马庆雷 政府副主席欧阳晓晖 武警内蒙古总队司令员刘会成 内蒙古军区副司令员张英奎 在那次会议上，石泰峰还提了几个要求，包括“建强边境防控基础设施”“强化科技管边控边”“建立健全党政军警民日常联防和应急联防行动的组织指挥机制”“深化对外交往，做好睦边工作”等。 中央政治局对沿边沿海各级党委提要求 肩负强边固防任务的不仅仅是内蒙古。 作为边海防大国，我国有着漫长的陆地边界线、大陆海岸线。边海防工作，是治国安邦的大事，关系国家安全和发展全局。 高层对强边固防也十分重视。 2018年4月，中央政治局会议曾审议了《关于新时代加强党政军警民合力强边固防的意见》。 那次会议提到，沿边沿海各级党委“要落实主体责任”。 要统筹强边固防和“一带一路”建设、脱贫攻坚、兴边富民、生态保护等工作，促进边境地区经济社会发展和对外开放，维护沿边沿海地区和管辖海域安全稳定与繁荣发展。 当年12月，国务委员兼国防部长魏凤和以“国家边海防委员会主任”身份召开“国家边海防委员会工作推进会议”，就党政军警民合力强边固防工作进行了部署。 在这样的背景下，这几年，相关边境省份对边境工作均十分重视。 “绷紧维护社会稳定和戍边守防这根弦” 除内蒙古外，前几天，新疆的政法委书记也去了边境。 6月19日至20日，新疆维吾尔自治区党委副书记、政法委书记，兵团党委书记、政委王君正赴五师双河市调研。 据《兵团日报》披露，王君正到了八十四团、八十一团，深入边境管理指挥部和屯兵基地，考察守边护边和民兵队伍建设情况，现场观摩军警兵民联合戍边演练和基干民兵训练。 他强调，坚定不移履行维稳戍边职责使命。 “始终绷紧维护社会稳定和戍边守防这根弦，坚持警钟长鸣、警惕常在，做实强边固防工作，锻造一流民兵队伍，落实常态化维稳措施，做深做细做实群众工作，不断筑牢社会稳定和长治久安的基础。” 政知君注意到，就算在假期，边防的官兵们也并没有休息。 据央视新闻报道，在西藏近4000公里的边防线上，有不少地段需要边防官兵徒步完成巡逻任务。 端午节期间，西藏边防官兵仍然坚守着战位，全副武装走上巡逻路，到点到位宣示主权。 端午佳节，不只有阖家团圆，还有家国边关安全。 资料 | 内蒙古新闻网  央视  澎湃新闻等,祝加贝 ,64
