标题,时间,来源,正文,作者,评论数
北京丰台等区购自新发地肉类海鲜库存已处置完毕,2020-06-27,北京晚报,原标题：丰台等区购自新发地肉类海鲜库存已处置完毕 本报讯（记者张楠）记者昨天从本市监管部门了解到，目前丰台、海淀、顺义、昌平、大兴等区所有购自新发地的肉类海鲜等库存产品已全部按照医疗废弃物处置完毕，不会流入市场。 6月21日至24日，丰台区市场监管局连续4天配合环保技术公司，完成了对丰台区已封存的从新发地批发市场购进的肉类、海鲜、豆制品等所有库存商品销毁前的清理、收集及运送工作。清理、收集及运送物品共计8173.29公斤，涉及辖区内19家市场（45个商户）、75家餐饮单位、3家流通领域经营主体。24日当天对辖区内剩余7家涉及人员隔离、场所封闭的单位完成清运工作，共计131.75公斤。丰台区市场监管局食品市场科科长郭少民表示，集中清运前，对5月30日至6月12日从新发地销售出来的商品，已要求商户下架、就地封存，请第三方专业机构统一收集、运送，进行无害化处理。截至目前，丰台区已完成区域内新发地市场封存商品的收集、清理。 海淀市场监管局此前排查出从新发地采购的肉类和海鲜，也已经统一封存、消杀，所有库存商品已经按照全市统一要求处置完毕，不会再流入市场。 记者从顺义区市场监管局了解到，按照全市统一要求，顺义区所有购自新发地市场的肉类海鲜库存，经封存、消杀，已全部按照医疗废弃物处置完毕。截至6月23日，顺义区共排查出9家单位从新发地市场采购的共计210.83公斤海鲜、肉类库存产品。顺义区市场监管局成立了处置工作专班，制定《顺义区关于新发地批发市场流出物品处置工作方案》，明确所有新发地批发市场流出物品一律参照医疗废弃物相关技术标准进行处理，并对部门职责、处理流程及时间安排进行详细部署。按照“确量留证”的原则和CDC防护技术规范要求，对涉及企业所封存的物品进行种类、数量登记造册，移交专业技术公司进行收储运输和无害化处理，确保全流程安全。截至23日，封存物品全部处置完毕，杜绝再流入市场。 截至6月24日晚8点，大兴区全部完成新发地流出的肉品海鲜清运处置工作，共清运新发地流出肉品海鲜106个点位3754.54公斤，清运处置点位占全市三分之一。 大兴区市场监管局采取查看票据、检查冰箱冰柜等多种方式对辖区农贸市场、商场超市、菜店、食杂店、新发地直营店、餐馆、集体用餐配送单位、中央厨房、单位食堂在新发地市场采购使用的猪肉、羊肉、牛肉、禽肉等及海鲜开展全面、多次、逐户排查，对排查出来的上述肉品、海鲜全部就地下架封存。同时按照市防疫要求，主动对接相关环保技术公司，将排查出的肉品和海鲜按医疗垃圾回收处理。仅用3天时间即完成全部清运处理，提前一天完成任务，及早消除了疫情传播隐患。 本市市场监管部门近日展开全市食品安全大检查，排查隐患，追根溯源。相关负责人表示，结合疫情防控的新形势，生鲜、冷冻猪肉、牛肉、羊肉、鸡鸭肉等畜禽肉类、水产品及其制品都是近期监管的重点产品。“现在上架的、市民能买到的商品，都是经过检测的合格品，市民可以放心购买。”,祝加贝 ,11
四川冕宁爆发特大山洪灾害 灵山景区营救游客53人,2020-06-27,红星新闻,原标题：四川冕宁爆发特大山洪灾害，灵山景区营救被困游客53人 6月26日晚至27日凌晨，四川省凉山州冕宁县遭遇强降雨，部分地区爆发特大山洪灾害。受山洪影响，在冕宁县境内灵山温泉自驾游营地，50多名游客被困，当地政府多个部门、消防等救援人员赶往现场营救。截止27日早晨，这些游客全部被转移到安全地带。 27日上午，冕宁县人民政府新闻办通报，冕宁县已启动II级山洪灾害防御响应，经昼夜奋战，灵山景区营救被困游客53人，工作人员2人，当地群众78人，景区游客全部脱离危险。 27日凌晨，冕宁灵山温泉自驾游营地遭遇山洪。据一名游客介绍，26日晚上，冕宁县迎来强降雨；到了27日凌晨，他们发现洪水来了。 “自驾车营地里面主要是玻璃民宿，洪水来了之后，房屋不断作响，水位不断上涨，水位最高的时候估计有几十厘米。”这名游客称，当洪水来临之后，他们有的人在屋内避险，有的人爬到了车顶，等待救援人员前来。 “道路冲断了，路边有的小车都被大水冲走。”这名游客回忆，山洪灾害发生后，冕宁县相关领导及应急、公安、消防等部门陆续抵达营地附近，但因为道路多处中断，救援十分困难。红星新闻记者从凉山交警部门获悉，因山洪泥石流影响，G108线冕宁县彝海镇曹古路段、白瓦桥灵山寺路段道路中断。 凌晨四五点，有救援人员敲碎了民宿的玻璃，将部分被困游客救出；而消防人员用挖掘机将一个个被困游客转移到安全地带。红星新闻记者了解到，截止今日早上，该营地被困的50多名游客被救出，转移到酒店安置。 6月27日上午，凉山州冕宁县人民政府新闻办对“6.26”强降雨灾害进行了通报，6月26日18时~27日零时，冕宁县北部地区遭遇强降雨。26日23时至23时40分，彝海镇、高阳街道受短时间内的特大暴雨影响，部分地区爆发特大山洪灾害。 通报称，冕宁县已启动II级山洪灾害防御响应，截至27日3时30分，高阳街道办转移600余户3000余人，惠安镇转移9户36人，彝海镇转移620户3000余人，大桥镇转移52户285人，合计1281余户6321余人。 经昼夜奋战，灵山景区营救被困游客53人，工作人员2人，当地群众78人，景区游客全部脱离危险。 目前，冕宁县已成立前线指挥部，相关部门和乡镇（街道）正在全力组织开展抗灾救援工作。灾情情况正在统计之中。 6月27日中午，红星新闻记者联系上凉山州消防救援支队，救援人员表示，从昨晚开始到今日中午12点，他们一直在洪灾现场救援，忙着转移被困的游客和群众。目前，疲惫的消防员正在短暂休整，下午进入灾区继续搜救。 红星新闻记者 江龙  凉山消防及交警部门供图,杨杰 ,0
重庆市水文监测总站发布洪水蓝色预警！,2020-06-27,环球网,原标题：重庆市水文监测总站发布洪水蓝色预警！铜梁小安溪未来6小时将涨水4.5-5.5米 [洪水蓝色预警！铜梁小安溪未来6小时将涨水4.5-5.5米 ]重庆市水文监测总站6月27日13时发布洪水蓝色预警： 受降雨影响，预计铜梁区小安溪虎峰站未来6小时内将出现明显涨水过程，最高水位将达到警戒水位（264.50米）左右，涨幅约4.5-5.5米。（文字/周小平）,杨杰 ,0
紧急！红色预警，80年来首次,2020-06-27,央视,原标题：紧急！红色预警，80年来首次 进入6月下旬，我国西南东北部、江淮、江南北部、湖北等地同时迎来了一次强降雨过程，受集中降雨的影响，金沙江中游的36条河流出现了超预警以上的洪水，其中重庆綦江上游干流及四川大渡河支流小金川发生了超历史洪水。受上游密集降雨的影响，6月22日，綦江流域重庆段全线告急，重庆市水文监测总站发出了80年以来的首次洪水红色预警。 水位暴涨、河水倒灌 30吨货船威胁桥墩！ 綦江区位于重庆市南部，地处四川盆地与云贵高原结合部，地势南高北低，以山地、丘陵为主。綦江河纵贯南北，穿流而过。6月22日清晨，重庆的綦江河两岸，雨雾弥漫，暴雨已经持续了整整一个晚上。 6月22日上午十一点，綦江区多个街道和乡镇，雨势突然增大，一时间，多条道路积水、汽车被淹，受强降雨的冲刷，局部地区接连爆发了小型的山体滑坡。十一点二十分左右，綦江河超过了警戒水位。 半个小时后，重庆市水文监测总站发出了洪水红色预警。这是重庆市水文监测站1940年建站以来，首次拉响红色警报。 暴雨一直在持续，上游洪水不断涌来，6月22日下午三点，綦江河已经超过保证水位4米，沿岸公路被淹，洪水开始持续倒灌。 6月22日下午六点半，重庆水文监测总站再次发布紧急消息，五岔站最高水位已达205.56米，超过保证水位5.05米，超过1998年洪水水位0.01米，达建站以来最高水位。受暴雨和洪水的冲击，重庆綦江区内险情不断。 在巨大的洪流之中，一艘自重近30吨货船失去了动力无法航行，2名船主被困在船上，一旦船只被冲走，将会对下游的桥墩造成毁灭性的冲击。 水位上涨迅猛、水流愈发湍急，周围环境复杂多变，现场情况十分紧急。消防队员们决定，用抛绳枪去固定船只。他们先通过抛投器将绳索运送至货船上，再运送钢丝将货船固定，防止货船被洪水冲走。随后，救援人员迅速搭建绳桥，同时紧急固定船体，救援出船主之后也尽力保住了船主赖以生存的货船。 綦江区赶水胜利街菜市场，多名群众被围困在了洪水之中，洪水最深的地方超过了三米，房屋有随时坍塌的危险。消防队员最终成功解救并疏散41名群众。 綦江区綦江中学的老校门，洪水已经将通往居民住宅楼的道路淹没。其中一栋楼的一层，已经完全淹没在洪水之中，消防员翻越围栏进入住户房内，将被困人员接到橡皮艇上，转移到了安全区域。 凌晨时分，南川区金石路一处低洼地老旧小区居民楼被淹，并随时有坍塌的风险。经过2小时的持续救援，消防员王开春和战友采取背抱的方式，在湍急的深水中艰难前进，解救出四名被困者。为了排除居民楼坍塌的风险，消防队员们又紧急利用抽水泵，将居民家中的积水快速排出。 刚刚完成上一个救援任务，王开春和战友们又接到警情，南川城区、部分农村地区发生内涝，积水最深处达1米，导致多处人员、车辆、物资被困。尤其是在恒大滨河左岸工棚里，有很多施工的工人被困。 消防救援人员三个人一组，引导被困者逃离受灾区域，在消防队员的协助下将全部被困人员及部分物资转移至安全区域。 截至6月22日晚间，重庆綦江消防救援支队共接到抗洪抢险报警23起，出动车辆32辆次，出动人员170人次，共营救出被困人员99人，疏散群众650余人。重庆南川消防救援支队共处置抗洪抢险26起，出动236人次，车辆48辆次，营救被困人员49人。 抢时间、拼速度 他们是暴风雨中的“逆行人”！ 突如其来的洪水，给重庆市的多个县区都带来了不同程度的破坏和损失。国家防汛抗旱总指挥部统计显示：截至6月22日晚间，洪涝灾害已造成重庆市綦江、巫山、彭水等26个县（区）21万人受灾，11.1万人转移避险，近1900人需紧急生活救助，200余间房屋倒塌，农作物受灾面积7.3千公顷，直接经济损失2.1亿元。 6月22日夜间，綦江河最大洪峰顺利过境，洪水退去之后，清淤、消杀、排险工作陆续展开。虹桥路街边有大量被洪水冲刷出来的物品，附近的居民满身泥水，光着脚在泥水中搬运自己的物品。受洪水影响，河边街道的电力处于中断状态，各种应急抢险车纷纷打开车灯，给街道照明。 在另一条街道上，整个路面全部被淤泥覆盖，洪水冲刷出来的树木和杂物堆满了街道。环卫工人高师进哭着告诉记者，接到任务时，她鞋子都来不及换掉，就直接赶到了一线，把八岁的儿子一人留在了家里。现在，她和上百名环卫工人一起已经工作了五个多小时。 綦江区消防救援支队支队长袁美军带领着消防队员，已经连续奋战了22个小时，来不及休息的他，又投入到了清理道路的工作中来。 6月23日凌晨2点45分，整条街依旧处于停电状态，消防车在给前方清理淤泥的环卫工人们照明，疲惫到极点的消防队员们，累得只能在车边稍事休息。 6月23日清晨时分，记者再次来到綦江河边，街道已经被清理得干干净净，恢复了往日的模样。周围的居民又重新开始了一天的生活。 延伸阅读： 雨雨雨一直下……9万多座水库还安全吗？ 夏至刚过，南方又开启了“喋喋不休”的强降雨模式。 中央气象台继续发布南方暴雨黄色预警！重庆綦江綦河更是超过保证水位4米，群众转移4万余人。 雨这么猛，还要下多久？南方大大小小的水库还安全吗？暴雨当前，个人如何保证安全？ 暴雨“不下线”，这8个地方更应该注意 这轮强降雨，两天前就“上线”了。 监测显示，自6月20日以来，贵州、重庆至长江中下游一带出现较强降雨。 6月22日11时50分，重庆市水文监测总站发布洪水红色预警。此次红色预警是重庆市水文监测总站1940年建站以来的首次红色预警。 21日夜间到22日白天，贵州多地有大雨到暴雨，局部大暴雨，个别乡镇有特大暴雨。 气象专家提醒，此轮降雨过程持续时间长、累计雨量大，致灾风险高。未来几天，强降雨仍将聚集在重庆、贵州、湖南、湖北、江西、安徽、江苏以及广西等地。 形势“不乐观”，长江中下游可能会受大影响 暴雨多了，洪水也少不了。 监测统计，今年以来，我国遭受强降雨影响明显多于往年。 什么样的形势才能叫不容乐观呢？ 水利部统计，今年以来全国共有16个省区198条河流发生超警戒以上洪水，多于常年同期。其中，有8条河流发生超保（洪水位超过保证水位）洪水，8条河流发生超历史水位洪水。 超警河流多的背后就是强降水过程多。 据了解，今年以来已发生了二十余次强降水过程，是2013年以来第二多。 全国全面入汛短短20来天，共有16个省区171条河流发生超警以上洪水。 在北方，宁夏中卫市沙坡头区下河沿村黄河入境流量21日达到2130立方米每秒，这标志着黄河2020年第1号洪水进入宁夏境内。 在南方，主要江河水位普遍偏高，长江中下游干流及洞庭湖、淮河上中游、西江、太湖等主要江河水位偏高0.19米至3.59米。 专家强调，预测现在的江南长江中下游梅雨期偏长，梅雨量偏大。受此影响，长江中下游地区，可能会发生区域性较大洪水。 水利工程还安全吗？需要做哪些准备 洪水那么大，水利工程安全吗？ 水利部副部长叶建春表示，目前我国的防洪工程能够防御新中国成立以来的最大洪水。 但是，也有不确定因素。 一个是超标洪水，可能会超出现有防御能力，形成“黑天鹅”事件。 另一个就是部分小型水库存在病险，不能按照原来的设计能力防洪和挡水。 应对这些不确定性因素，要做好准备，有备无患。 首先，要编制好超标洪水防御预案。 目前，水利部正指导各地水利部门在6月底前编制完善江河和城市超标洪水防御预案，狠抓预测预报、水工程调度、堤防抢护、人员转移等各个环节措施的落实，做好防范应对准备。 其次，9万多座水库都得有人管。 目前，我国共有9.8万多座水库，其中9.4万多座是小型水库，有一部分存在病险。因此，要压实责任，使相应责任人对水库负起相应的防洪责任。 再次，防洪工程将及时派上用场。 要加强水库运行监管。比如，在汛情发生前，水库能够降到汛限水位以下，腾出库容拦洪，既保水库安全，又通过水库调度保下游安全。 个人如何防范风险 洪水可怕，山洪可怕，做好防御，就没啥可怕的。 相比洪水，山洪因为没有工程措施可以阻拦，所以致灾性更强。据统计，山洪灾害伤亡人数占洪涝灾害伤亡人数70%左右。 防御山洪，最主要的办法就是预警。 水利部相关负责人介绍，水利部和气象局联合发出预警，各地进一步把更准确的预警信息发给相关责任人和受威胁的群众。 相关部门还与工信部一起协调“三大运营商”，通过运营商，把这些预警信息发给所有受威胁地区的群众。 据了解，地方政府这几年来也积累了很多经验，比如“包保”制度，叫县包乡、乡包村、村包组、组包户、党员干部包群众，这一系列的包保制度就希望能够使每一个人、每一个可能受到山洪灾害威胁的群众都不被漏掉。 群众还总结出一些比较好的方法，叫“方向对，跑得快”，山洪都是从山顶往下冲，如果往山脊上跑，不跑到山沟里去，安全还是有保障的。,杨杰 ,380
又送毕业福利!手绘版校园萌猫后 北大将燕园搬到纸上,2020-06-27,北京日报客户端,原标题：又送“毕业福利”！手绘版校园萌猫后，北大将燕园搬到纸上 几天前，64岁的北京大学法学院教授吴志攀为毕业生手绘校园萌猫，在网上刷屏。今天，北大又推出一份特别定制的“毕业福利”，一张精致的毕业典礼门票，平铺时，镌刻燕园繁花，翻折后勾勒一塔一图，堪称缩微版美景，本届毕业生每人都将收获这份专属纪念。 根据《关于北京大学2020年毕业典礼安排的通知》，今年，北大毕业典礼将于7月2日上午8时举行，在2021年5月校庆期间和2021年毕业季，学校将为2020届毕业生分别安排专场学位授予仪式，毕业生可以申请返校参加其中一场；如上述两场学位授予仪式均无法参加，毕业生可在今后任何一年返校参加一次学位授予仪式。 今天，北大为2020届毕业生打造的定制版毕业典礼门票亮相。门票设计独具匠心，平铺时候，门票上的桃花、紫藤、银杏和梅花四中植物花卉，带领大家重拾燕园四季风景；而沿虚线折起后，一处缩微版燕园景物跃然纸上，与四处植物花卉分别对应的是学校标志性景观：北大西门、博雅塔、图书馆和百周年纪念讲堂。 北大承诺，2020届所有毕业生都能收到这张毕业门票；返校毕业生可现场领取门票，未返校的毕业生，学校将通过院系发放门票。 除了别具巧思的门票，北大此次毕业典礼的举行场地从曾经的邱德拔体育馆转移到了学校的各处“宝地”，典礼共设置9个会场，分别为北大办公楼西侧、英杰交流中心广场、静园草坪、未名湖、百年讲堂广场、邱德拔北广场、人文学苑广场、医学部、深圳研究生院。 除了毕业门票，北大还为毕业生打造了不少惊喜，其中，北大老教授吴志攀为毕业生创作的《校园猫的故事》看哭了很多网友。作品中，老教授以水墨画形式记录了校园猫与北大学子互动的过往，画作在学生帮助之下制作成电子相册，每一幅画面旁边，还配有以猫咪口吻书写的旁白： 我们是几只校园猫。 你们在学校时，我们很快乐，现在很寂寞。 那时你们每天喂我们，我们可以吃到各种零食。 你们上课时，我们就在教室里睡觉， 老师讲课的声音是我们最好的催眠曲。 你们下课时，会跟我们玩，拍照和转发。 你们有了什么秘密也跟我们分享…… 前几天听说你们要回来了， 我们高兴极了，一大早就跑到校门口去等。 法学院准备了很多礼物要送给你们， 其中还有好吃的呢！ 后来又听说停止返校了，因为北京的疫情。 这让我们很难过， 因为没有好吃的了…… 法学院的老师安慰我们说，别难过，你们会回来的。 我们相信老师说的话，因为她是教法律的。 我们会在校园里一直等着你们回来， 这校园是永远的。,杨杰 ,0
中国冰壶裁判将首次执裁冬奥会及冬残奥会比赛,2020-06-27,新京报,原标题：中国冰壶裁判将首次执裁冬奥会及冬残奥会比赛 据国家体育总局冬季运动管理中心消息，王珏、李凌姝、于亮、牛晓暹四名中国裁判日前入选2022年北京冬奥会及冬残奥会国际技术官员名单，这将是中国冰壶裁判首次执裁冬奥会及冬残奥会比赛。,杨杰 ,1
拒绝揽炒，勇往直前！近500名香港青年骑行庆回归,2020-06-27,北京日报客户端,原标题：拒绝揽炒，勇往直前！近500名香港青年骑行庆回归 香港即将迎来回归祖国23周年。近日，香港民建联大埔支部及北区支部号召新界东的香港青年一起骑自行车巡游，庆祝回归。民建联立法会议员陈克勤等召集人表示，“涉港国安法”立法，为香港未来的发展打了一支强心针，香港青年应拒绝揽炒，勇往直前，让香港重归繁荣稳定。 当天，共有近500名香港青年参加了活动，大家手持国旗和香港特别行政区区旗，从大埔大尾督出发，一路骑行巡游至近船湾淡水湖的停机坪前。年轻人朝气蓬勃，自行车阵浩浩荡荡，格外引人注目。 活动的召集者之一、民建联立法会议员陈克勤表示，过去一年，不断出现的黑暴让香港经济受到重创，市民的人身及财产安全受到严重威胁。甚至还有不少年轻人参与暴力示威，作出犯法行为。他呼吁广大年轻人不要再走歪路，承担建设香港的责任，放弃揽炒的心态，香港才会有未来。 民建联大埔支部主席谭荣勋表示， “涉港国安法”将在香港实施，如同为港人打了一支强心针，这次自行车巡游活动，寓意着年轻人骑行乘风破浪，勇往直前，让香港重归繁荣稳定。 民建联北区支部主席姚铭称，“黑暴和疫情让香港经济下滑，失业率持续攀升。香港实在没有揽炒的本钱。”他表示，看到今天浩浩荡荡的车队，感觉看到了香港未来的希望。希望香港的年轻人，拒绝揽炒，肩负起重建家园的使命。 30岁的香港青年潘孝汶和朋友一起参加了骑行巡游活动，他接受北京日报客户端记者采访时表示，年轻人是香港的希望和未来，理应热爱香港，肩负起建设香港的责任。“看到车阵出发的那一刻我很激动，香港年轻人应有一股勇往直前，拼搏向上的冲劲。希望可以通过这种方式，影响到更多年轻人，凝聚守护香港的力量。”,杨杰 ,48
四川凉山冕宁灵山景区突发山洪 游客讲述惊魂一刻,2020-06-27,央视,原标题：凉山冕宁灵山景区突发山洪 游客讲述惊魂一刻 6月27日凌晨，凉山州冕宁灵山温泉自驾游营地遭遇山洪袭击。一时间，营地内房屋被损，道路被冲毁。由于正值端午小长假，不少人在营地度假。凌晨1点15分左右，游客肖女士在睡梦中被吵醒，她起初以为是地震，很快，接到同行亲友的电话，称发生山洪，赶紧避险。当肖女士一家准备出门避险时，房间门被冲来的车将门抵得死死的。在好心人的帮助下，肖女士从房间窗户逃生出来，一家人逃到车顶上避险，等待救援。肖女士说，由于情况紧急，被困人群有的在房屋内避险，有的在车顶上避险。停在路边的小车也只能眼睁睁看着被大水冲走。（视频来源：四川观察）,杨杰 ,37
